tiitle,building,price,description
Торговое место у входа,Корпус А,12000,Компактное место с высоким пешеходным трафиком
Островок для фермерской продукции,Корпус А,15000,Подходит для продажи продуктов и сезонных товаров
Витринное место,Корпус Б,18000,Место рядом с витринами и зоной ожидания
Место под кофе-точку,Корпус Б,22000,Можно разместить небольшую кофейню или точку навынос
Рядовое торговое место №5,Корпус А,10000,Бюджетный вариант для теста продаж
Торговое место с угловой выкладкой,Корпус А,17000,Удобно для заметной выкладки товара
